{
  "id": "password-reset",
  "title": "Reset your password",
  "category": "account",
  "tags": ["password", "reset", "login", "forgot", "account"],
  "body": "# Reset your password\n\nIf you've forgotten your password or need to reset it for security reasons:\n\n1. Go to the login page and click **Forgot password**.\n2. Enter the email address associated with your account.\n3. Check your inbox for a reset link (valid for 30 minutes).\n4. Click the link and choose a new password (at least 12 characters, one number, one symbol).\n5. Log in with your new password.\n\nIf you don't receive the email within a few minutes, check your spam folder or contact support to verify your account email is correct."
}
